[
  {
    "id": 1,
    "question": "اگر معادله پارابولا (y-4)²=12(x-1) باشد محور تناظر آن عبارت است از:",
    "options": [
      "y=4",
      "y=-4",
      "x=1",
      "x=-1"
    ],
    "correctOption": 1,
    "correctAnswer": "y=4",
    "subject": "Math",
    "difficulty": "medium"
  },
  {
    "id": 2,
    "question": "طول شعاع دایره x²+y²-2x-14y-12=0 عبارت است از:",
    "options": [
      "√62",
      "√41",
      "√63",
      "√65"
    ],
    "correctOption": 1,
    "correctAnswer": "√62",
    "subject": "Math",
    "difficulty": "medium"
  },
  {
    "id": 3,
    "question": "فاصله خط مستقیم 3x-4y-30=0 را از مبدا کمیات وضعیه دریابید:",
    "options": [
      "2",
      "3",
      "6",
      "5"
    ],
    "correctOption": 3,
    "correctAnswer": "6",
    "subject": "Math",
    "difficulty": "medium"
  },
  {
    "id": 4,
    "question": "مرکز دایره x²+y²-2x-4y+2=0 عبارت است از:",
    "options": [
      "(-1,-2)",
      "(1,-2)",
      "(1,2)",
      "(-1,2)"
    ],
    "correctOption": 3,
    "correctAnswer": "(1,2)",
    "subject": "Math",
    "difficulty": "medium"
  },
  {
    "id": 5,
    "question": "فاصله بین دو نقطه (2,7) و (2,-3) عبارت است از:",
    "options": [
      "0",
      "10",
      "4",
      "√10"
    ],
    "correctOption": 2,
    "correctAnswer": "10",
    "subject": "Math",
    "difficulty": "medium"
  },
  {
    "id": 6,
    "question": "اگر معادله بیضوی بصورت 9x²+10y²=90 عن المزكيت (Eccentricity) آن عبارت است از:",
    "options": [
      "√10/10",
      "1/10",
      "√10/3",
      "3/√10"
    ],
    "correctOption": 1,
    "correctAnswer": "√10/10",
    "subject": "Math",
    "difficulty": "medium"
  },
  {
    "id": 7,
    "question": "خط مستقیم y-x-2=0 با محور مثبت x زاویه چند درجه را میسازد:",
    "options": [
      "90 درجه",
      "45 درجه",
      "135 درجه",
      "315 درجه"
    ],
    "correctOption": 2,
    "correctAnswer": "45 درجه",
    "subject": "Math",
    "difficulty": "medium"
  },
  {
    "id": 8,
    "question": "فاصله خط مستقیم 3x-4y-25=0 از مبدا کمیات وضعیه مساوی است به:",
    "options": [
      "6",
      "4",
      "2",
      "5"
    ],
    "correctOption": 4,
    "correctAnswer": "5",
    "subject": "Math",
    "difficulty": "medium"
  },
  {
    "id": 9,
    "question": "مسافه بين خط مستقیم y=4 و محور x مساوی است به:",
    "options": [
      "3",
      "6",
      "5",
      "4"
    ],
    "correctOption": 4,
    "correctAnswer": "4",
    "subject": "Math",
    "difficulty": "medium"
  },
  {
    "id": 10,
    "question": "معادله خط مستقیم که از جوره های نقاط (3,2) و (2,3) عبور مینماید, عبارت است از:",
    "options": [
      "y=-x+5",
      "y=x+1",
      "y=x-5",
      "y=-x-1"
    ],
    "correctOption": 1,
    "correctAnswer": "y=-x+5",
    "subject": "Math",
    "difficulty": "medium"
  },
  {
    "id": 11,
    "question": "معادله خط مستقیم که از نقطه (9,-3) میگذرد و با محور y موازی باشد, عبارت است از:",
    "options": [
      "x=3",
      "x=-3",
      "x=9",
      "x=-9"
    ],
    "correctOption": 3,
    "correctAnswer": "x=9",
    "subject": "Math",
    "difficulty": "medium"
  },
  {
    "id": 12,
    "question": "فاصله نقطه p(-1,-1) از مستقیم x+y=1 مساوی است به:",
    "options": [
      "√2/2",
      "0",
      "3√2/2",
      "2√2/2"
    ],
    "correctOption": 3,
    "correctAnswer": "3√2/2",
    "subject": "Math",
    "difficulty": "medium"
  },
  {
    "id": 13,
    "question": "میل خط مستقیم 5x-3y-3=0 را دریابید:",
    "options": [
      "5/3",
      "-3/5",
      "3/5",
      "-5/3"
    ],
    "correctOption": 1,
    "correctAnswer": "5/3",
    "subject": "Math",
    "difficulty": "medium"
  },
  {
    "id": 14,
    "question": "میل خط مستقیم که از نقاط P(-1,2) و Q(3,2) میگذرد مساوی است به:",
    "options": [
      "0",
      "-1",
      "1",
      "2"
    ],
    "correctOption": 1,
    "correctAnswer": "0",
    "subject": "Math",
    "difficulty": "medium"
  },
  {
    "id": 15,
    "question": "معادله دايره که شعاع آن 2√3 واحد و مرکز آن در مبدا کمیات وضعیه باشد عبارت است از:",
    "options": [
      "x²+y²-54=0",
      "x²+y²-25=0",
      "x²+y²-12=0",
      "x²+y²+12=0"
    ],
    "correctOption": 3,
    "correctAnswer": "x²+y²-12=0",
    "subject": "Math",
    "difficulty": "medium"
  },
  {
    "id": 16,
    "question": "معادله دایره که مرکز آن (4,-1) و شعاع آن 10 واحد باشد عبارت است از:",
    "options": [
      "x²+y²=83",
      "x²+y²-8x+2y-83=0",
      "x²+y²+8x-2y-83=0",
      "x²+y²=100"
    ],
    "correctOption": 2,
    "correctAnswer": "x²+y²-8x+2y-83=0",
    "subject": "Math",
    "difficulty": "medium"
  },
  {
    "id": 17,
    "question": "اگر معادله بیضوی بصورت 9x²+10y²-90=0 باشد فاصله بین محراقهای آن مساوی است به:",
    "options": [
      "4√60",
      "2",
      "2√5",
      "4√5"
    ],
    "correctOption": 2,
    "correctAnswer": "2",
    "subject": "Math",
    "difficulty": "medium"
  },
  {
    "id": 18,
    "question": "معادله خط مستقیم که میل آن 2√2 و محور Y را در (0, √5) قطع کند عبارت است از:",
    "options": [
      "y=√3x+√5",
      "y=√3x-√5",
      "y=2√2x-√5",
      "y=2√2x+√5"
    ],
    "correctOption": 4,
    "correctAnswer": "y=2√2x+√5",
    "subject": "Math",
    "difficulty": "medium"
  },
  {
    "id": 19,
    "question": "فاصله خط مستقیم 4x-3y-60=0 از مبدا کمیات وضعیه مساوی است به:",
    "options": [
      "10",
      "14",
      "9",
      "12"
    ],
    "correctOption": 4,
    "correctAnswer": "12",
    "subject": "Math",
    "difficulty": "medium"
  },
  {
    "id": 20,
    "question": "کمیات وضعیه نقطه وسطی قطعه خط که از نقاط A(3,1) و B(-2,4) عبور میکند مساوی است به:",
    "options": [
      "(1/2,-3/2)",
      "(-1/2,3/2)",
      "(-1/2,-3/2)",
      "(1/2,5/2)"
    ],
    "correctOption": 4,
    "correctAnswer": "(1/2,5/2)",
    "subject": "Math",
    "difficulty": "medium"
  },
  {
    "id": 21,
    "question": "معادله پارابولا که محور تناظر روی محور X منطبق باشد عبارت است از:",
    "options": [
      "X²=4PY",
      "Y²=4PX",
      "Y=4PX",
      "X=4PY"
    ],
    "correctOption": 2,
    "correctAnswer": "Y²=4PX",
    "subject": "Math",
    "difficulty": "medium"
  },
  {
    "id": 22,
    "question": "هر گاه یک مخروط توسط مستوی طوری قطع شود که موازی به مولد مخروط باشد شکل حاصله عبارت است از:",
    "options": [
      "دایره",
      "هایپربولا",
      "بیضوی",
      "پارابولا"
    ],
    "correctOption": 4,
    "correctAnswer": "پارابولا",
    "subject": "Math",
    "difficulty": "medium"
  },
  {
    "id": 23,
    "question": "نقطه (1, 2) در کدام یکی از ربعهای ذیل واقع است:",
    "options": [
      "II",
      "III",
      "IV",
      "I"
    ],
    "correctOption": 4,
    "correctAnswer": "I",
    "subject": "Math",
    "difficulty": "easy"
  },
  {
    "id": 24,
    "question": "اگر x ≠ 0 و y = 0 باشد, موقعیت نقطه (x,y) عبارت است از:",
    "options": [
      "بالای محور x",
      "بالای محور y",
      "ناحیه سوم",
      "ناحیه چهارم"
    ],
    "correctOption": 1,
    "correctAnswer": "بالای محور x",
    "subject": "Math",
    "difficulty": "easy"
  },
  {
    "id": 25,
    "question": "فاصله بین خطوط y = 2 و y = -1/2 مساویست به:",
    "options": [
      "2",
      "2.5",
      "3",
      "5"
    ],
    "correctOption": 2,
    "correctAnswer": "2.5",
    "subject": "Math",
    "difficulty": "medium"
  },
  {
    "id": 26,
    "question": "فاصله نقطه P(1,-2) از خط مستقیم 8x-y-1=0 مساوی است به:",
    "options": [
      "10√65/65",
      "9√65/65",
      "√65/65",
      "√65/13"
    ],
    "correctOption": 2,
    "correctAnswer": "9√65/65",
    "subject": "Math",
    "difficulty": "hard"
  },
  {
    "id": 27,
    "question": "معادله خط مستقیمی 0 = 4-y به شکل نورمال عبارت است از:",
    "options": [
      "x cos 90° + y sin 90° + 4 = 0",
      "x cos 90° + y sin 90°-4=0",
      "x cos90°-1=0",
      "xsin 90° +1=0"
    ],
    "correctOption": 2,
    "correctAnswer": "x cos 90° + y sin 90°-4=0",
    "subject": "Math",
    "difficulty": "medium"
  },
  {
    "id": 28,
    "question": "معادله خط مستقیمی که از نقطه (-√5,4) میگذرد و با محور y موازی باشد. عبارت است از:",
    "options": [
      "x = −4",
      "x = √5",
      "x = 4",
      "x = -√5"
    ],
    "correctOption": 4,
    "correctAnswer": "x = -√5",
    "subject": "Math",
    "difficulty": "medium"
  },
  {
    "id": 29,
    "question": "اگر A(2,6), B(2,-6) و C(2,-2) راس های یک مثلث باشند, این نقاط:",
    "options": [
      "تشکیل مثلث نمیدهند (روی یک خط هستند)",
      "قائم الزاویه",
      "منفرجه الزاویه",
      "متساوی الاضلاع"
    ],
    "correctOption": 1,
    "correctAnswer": "تشکیل مثلث نمیدهند (روی یک خط هستند)",
    "subject": "Math",
    "difficulty": "medium"
  },
  {
    "id": 30,
    "question": "معادله دو خط مستقیم به ترتیب 0 = 5+3x-2y و 0 = 3-4y-5x است. این دو خط مستقیم با هم دارای کدام حالت زیر می باشند:",
    "options": [
      "موازی اند",
      "منطبق اند",
      "متقاطع اند",
      "هیچکدام"
    ],
    "correctOption": 3,
    "correctAnswer": "متقاطع اند",
    "subject": "Math",
    "difficulty": "medium"
  },
  {
    "id": 31,
    "question": "مستقیم 6y-2√3x-2=0 با محور x زاویه چند درجه را می سازد:",
    "options": [
      "30 درجه",
      "45 درجه",
      "120 درجه",
      "270 درجه"
    ],
    "correctOption": 1,
    "correctAnswer": "30 درجه",
    "subject": "Math",
    "difficulty": "medium"
  },
  {
    "id": 32,
    "question": "کمیات وضعیه نقطه تنصیف خط مستقیم را دریابید که از نقطه (3√2,3√5) و (-√2,-√5) عبور می نماید:",
    "options": [
      "(√2,√5)",
      "(2√2,√5)",
      "(√5,√2)",
      "(√5,-√2)"
    ],
    "correctOption": 1,
    "correctAnswer": "(√2,√5)",